{
  "receipt_id": "odcr-c37f4886423cbd54",
  "schema": "owner-decision-custody-receipt-v1",
  "custody_source": "write",
  "source_contract": "#23",
  "decision_type": "denied",
  "generated_at": "2026-07-06T20:47:41Z",
  "deterministic": true,
  "immutable": true,
  "request": {
    "project_id": "qa-pilot",
    "sprint_id": "AG-7",
    "file_path": "blocked.txt",
    "transition": "",
    "reason": "test"
  },
  "enforcement": {
    "decision": "BLOCK_WRITE_SCOPE_VIOLATION",
    "blocker_code": "WRITE_SCOPE_VIOLATION",
    "violation_code": "WRITE_SCOPE_VIOLATION",
    "triggered_rules": []
  },
  "provenance": {
    "owner_approval_present": false,
    "owner_approval_ref": "",
    "approval_is_broad": false
  },
  "mutation_status": "blocked",
  "linked_references": {
    "sprint_id": "AG-7",
    "ledger_numbers": [],
    "source_receipt_id": ""
  },
  "sealed_contracts_referenced": [
    "#23"
  ]
}