{
  "receipt_id": "odcr-ab17af79bee5cd0f",
  "schema": "owner-decision-custody-receipt-v1",
  "custody_source": "write",
  "source_contract": "#23",
  "decision_type": "approved",
  "generated_at": "2026-07-06T20:47:42Z",
  "deterministic": true,
  "immutable": true,
  "request": {
    "project_id": "qa-pilot",
    "sprint_id": "SPRINT-X",
    "file_path": "docs/x.md",
    "transition": "",
    "reason": "test"
  },
  "enforcement": {
    "decision": "ALLOW",
    "blocker_code": "",
    "violation_code": "",
    "triggered_rules": []
  },
  "provenance": {
    "owner_approval_present": false,
    "owner_approval_ref": "",
    "approval_is_broad": false
  },
  "mutation_status": "mutated",
  "linked_references": {
    "sprint_id": "SPRINT-X",
    "ledger_numbers": [
      23,
      24,
      25
    ],
    "source_receipt_id": ""
  },
  "sealed_contracts_referenced": [
    "#23",
    "#24",
    "#25"
  ]
}